### ISSUE TITLE
Netmap mode on e1000 broken due to promisc patch

### ISSUE THREAD

**Issue by swhite2** [opnsense/src#86]
**Important notices**
Before you add a new report, we ask you kindly to acknowledge the following:

[x] I have read the contributing guide lines at https://github.com/opnsense/core/blob/master/CONTRIBUTING.md

[x] I have searched the existing issues and I'm convinced that mine is new.

**Describe the bug**
Commit https://github.com/opnsense/src/commit/b3665671c4d7cb79ee48cf438bff45ebad8241e4 describes an edit to the promiscuous flag for the e1000 Intel Network driver. Unfortunately, this patch seems te break the driver in netmap mode when using the 'bridge' utility provided by the original author of netmap.

20.7 -> working as expected
207.1 -> working as expected
20.7.2+ -> no packet passthrough from reply side.

When running an up-to-date kernel (currently 21.1.a), reverting the above mentioned commit and rebuilding the kernel will cause the bridge utility to work again as expected.

**To Reproduce**
1. With any OPNsense src release starting from 20.7.2 (with commit b3665671c4d7cb79ee48cf438bff45ebad8241e4), connect a setup described by the diagram below.
2. 
![bridge](https://user-images.githubusercontent.com/33954429/98657198-e06cb880-2341-11eb-9648-a267e925b078.png)
Where DEVICE is the machine running the software bridge.
3. Build the bridge application located in src/tools/tools/netmap using `make bridge`
4. Run the bridge application `./bridge -v -i netmap:igb2 -i netmap:igb3`.
5. Disable pf with `pfctl -d` on the target machine.
6. Open up `tcpdump -i igb(x)` on target machine.
7. Ping target machine.

**Expected behavior**
ARP and ICMP packets should reach the host network stack of the target machine and a reply will be generated and sent over the wire. These replies should pass through the igb interfaces and reach the original machine. However, the replies do not reach the original machine and are not picked up on the bridge utility.

**Relevant log files**

Target machine (tcpdump) - normal operation without patch
```
10:04:43.152338 ARP, Request who-has 10.1.1.3 (00:03:2d:4a:24:a6 (oui Unknown)) tell 10.1.1.2, length 46
10:04:43.152342 ARP, Reply 10.1.1.3 is-at 00:03:2d:4a:24:a6 (oui Unknown), length 28
10:04:56.168545 IP 10.1.1.2 > 10.1.1.3: ICMP echo request, id 1, seq 7042, length 40
10:04:56.168558 IP 10.1.1.3 > 10.1.1.2: ICMP echo reply, id 1, seq 7042, length 40
10:04:57.172232 IP 10.1.1.2 > 10.1.1.3: ICMP echo request, id 1, seq 7043, length 40
10:04:57.172235 IP 10.1.1.3 > 10.1.1.2: ICMP echo reply, id 1, seq 7043, length 40
10:04:58.179299 IP 10.1.1.2 > 10.1.1.3: ICMP echo request, id 1, seq 7044, length 40
10:04:58.179301 IP 10.1.1.3 > 10.1.1.2: ICMP echo reply, id 1, seq 7044, length 40
```

DEVICE (bridge machine) - using slightly modified bridge utility, printing raw packets (located https://github.com/swhite2/bridge) - normal operation without patch
```
145.536247 main [426] poll ok [0(netmap:igb2)] ev 5 4 rx 0@0 tx 4088, [1(netmap:igb3)] ev 0 0 rx 1@0 tx 4088
netmap:igb3 -> netmap:igb2 -- ARP request
------TX(copied)------
  0000  00 03 2d 4a 24 a6 48 65 ee 13 37 04 08 06 00 01  ..-J$.He..7.....
  0010  08 00 06 04 00 01 48 65 ee 13 37 04 0a 01 01 02  ......He..7.....
  0020  00 03 2d 4a 24 a6 0a 01 01 03 00 00 00 00 00 00  ..-J$...........
  0030  00 00 00 00 00 00 00 00 00 00 00 00              ............
145.536270 process_rings [204] net->host sent 1 packets to 0xdf0461000
145.536473 main [426] poll ok [0(netmap:igb2)] ev 1 1 rx 1@0 tx 4087, [1(netmap:igb3)] ev 1 0 rx 0@1 tx 4088
145.536485 main [426] poll ok [0(netmap:igb2)] ev 0 0 rx 1@0 tx 4087, [1(netmap:igb3)] ev 5 4 rx 0@1 tx 4088
netmap:igb2 -> netmap:igb3 -- ARP reply
------TX(copied)------
  0000  48 65 ee 13 37 04 00 03 2d 4a 24 a6 08 06 00 01  He..7...-J$.....
  0010  08 00 06 04 00 02 00 03 2d 4a 24 a6 0a 01 01 03  ........-J$.....
  0020  48 65 ee 13 37 04 0a 01 01 02 00 00 00 00 00 00  He..7...........
  0030  00 00 00 00 00 00 00 00 00 00 00 00              ............
145.536513 process_rings [204] net->host sent 1 packets to 0xdf04f1000
145.930341 main [426] poll ok [0(netmap:igb2)] ev 1 0 rx 0@1 tx 4087, [1(netmap:igb3)] ev 1 1 rx 1@1 tx 4087
145.930351 main [426] poll ok [0(netmap:igb2)] ev 5 4 rx 0@1 tx 4087, [1(netmap:igb3)] ev 0 0 rx 1@1 tx 4087
netmap:igb3 -> netmap:igb2 -- ICMP request
------TX(copied)------
  0000  00 03 2d 4a 24 a6 48 65 ee 13 37 04 08 00 45 00  ..-J$.He..7...E.
  0010  00 3c 06 58 00 00 80 01 1e 63 0a 01 01 02 0a 01  .<.X.....c......
  0020  01 03 08 00 31 bf 00 01 1b 9c 61 62 63 64 65 66  ....1.....abcdef
  0030  67 68 69 6a 6b 6c 6d 6e 6f 70 71 72 73 74 75 76  ghijklmnopqrstuv
  0040  77 61 62 63 64 65 66 67 68 69                    wabcdefghi
145.930374 process_rings [204] net->host sent 1 packets to 0xdf0461000
145.930491 main [426] poll ok [0(netmap:igb2)] ev 1 1 rx 1@1 tx 4086, [1(netmap:igb3)] ev 1 0 rx 0@1 tx 4087
145.930501 main [426] poll ok [0(netmap:igb2)] ev 0 0 rx 1@1 tx 4086, [1(netmap:igb3)] ev 5 4 rx 0@1 tx 4087
netmap:igb2 -> netmap:igb3 -- ICMP reply
------TX(copied)------
  0000  48 65 ee 13 37 04 00 03 2d 4a 24 a6 08 00 45 00  He..7...-J$...E.
  0010  00 3c b9 95 00 00 40 01 ab 25 0a 01 01 03 0a 01  .<....@..%......
  0020  01 02 00 00 39 bf 00 01 1b 9c 61 62 63 64 65 66  ....9.....abcdef
  0030  67 68 69 6a 6b 6c 6d 6e 6f 70 71 72 73 74 75 76  ghijklmnopqrstuv
  0040  77 61 62 63 64 65 66 67 68 69                    wabcdefghi
145.930523 process_rings [204] net->host sent 1 packets to 0xdf04f1000
```
----------------------------------------------------------------------------------------------------------------------------

Target machine (tcpdump) - with patch
```
10:23:18.328214 ARP, Request who-has 10.1.1.3 tell 10.1.1.2, length 46
10:23:18.328220 ARP, Reply 10.1.1.3 is-at 00:03:2d:4a:24:a6 (oui Unknown), length 28
10:23:19.157110 ARP, Request who-has 10.1.1.3 tell 10.1.1.2, length 46
10:23:19.157112 ARP, Reply 10.1.1.3 is-at 00:03:2d:4a:24:a6 (oui Unknown), length 28
10:23:20.156473 ARP, Request who-has 10.1.1.3 tell 10.1.1.2, length 46
10:23:20.156475 ARP, Reply 10.1.1.3 is-at 00:03:2d:4a:24:a6 (oui Unknown), length 28
```

DEVICE (bridge machine) - using slightly modified bridge utility, printing raw packets (located https://github.com/swhite2/bridge) - with patch
```
797.209623 main [426] poll ok [0(netmap:igb2)] ev 5 4 rx 0@0 tx 4092, [1(netmap:igb3)] ev 0 0 rx 1@0 tx 4092
netmap:igb3 -> netmap:igb2 -- ARP request
------TX(copied)------
  0000  ff ff ff ff ff ff 48 65 ee 13 37 04 08 06 00 01  ......He..7.....
  0010  08 00 06 04 00 01 48 65 ee 13 37 04 0a 01 01 02  ......He..7.....
  0020  00 00 00 00 00 00 0a 01 01 03 00 00 00 00 00 00  ................
  0030  00 00 00 00 00 00 00 00 00 00 00 00              ............
797.209725 process_rings [204] net->host sent 1 packets to 0x192a4c61000
798.038589 main [426] poll ok [0(netmap:igb2)] ev 1 0 rx 0@0 tx 4091, [1(netmap:igb3)] ev 1 1 rx 1@1 tx 4092
798.038604 main [426] poll ok [0(netmap:igb2)] ev 5 4 rx 0@0 tx 4091, [1(netmap:igb3)] ev 0 0 rx 1@1 tx 4092
netmap:igb3 -> netmap:igb2 -- ARP request
------TX(copied)------
  0000  ff ff ff ff ff ff 48 65 ee 13 37 04 08 06 00 01  ......He..7.....
  0010  08 00 06 04 00 01 48 65 ee 13 37 04 0a 01 01 02  ......He..7.....
  0020  00 00 00 00 00 00 0a 01 01 03 00 00 00 00 00 00  ................
  0030  00 00 00 00 00 00 00 00 00 00 00 00              ............
798.038623 process_rings [204] net->host sent 1 packets to 0x192a4c61000
799.037942 main [426] poll ok [0(netmap:igb2)] ev 1 0 rx 0@0 tx 4091, [1(netmap:igb3)] ev 1 1 rx 1@2 tx 4092
799.037956 main [426] poll ok [0(netmap:igb2)] ev 5 4 rx 0@0 tx 4091, [1(netmap:igb3)] ev 0 0 rx 1@2 tx 4092
netmap:igb3 -> netmap:igb2 -- ARP request
------TX(copied)------
  0000  ff ff ff ff ff ff 48 65 ee 13 37 04 08 06 00 01  ......He..7.....
  0010  08 00 06 04 00 01 48 65 ee 13 37 04 0a 01 01 02  ......He..7.....
  0020  00 00 00 00 00 00 0a 01 01 03 00 00 00 00 00 00  ................
  0030  00 00 00 00 00 00 00 00 00 00 00 00              ............
799.037979 process_rings [204] net->host sent 1 packets to 0x192a4c61000
801.539109 main [426] poll timeout [0(netmap:igb2)] ev 1 0 rx 0@0 tx 4090, [1(netmap:igb3)] ev 1 0 rx 0@3 tx 4092
804.049118 main [426] poll timeout [0(netmap:igb2)] ev 1 0 rx 0@0 tx 4090, [1(netmap:igb3)] ev 1 0 rx 0@3 tx 4092
806.550129 main [426] poll timeout [0(netmap:igb2)] ev 1 0 rx 0@0 tx 4090, [1(netmap:igb3)] ev 1 0 rx 0@3 tx 4092
809.071353 main [426] poll timeout [0(netmap:igb2)] ev 1 0 rx 0@0 tx 4090, [1(netmap:igb3)] ev 1 0 rx 0@3 tx 4092
```

**Additional context**
The bridge utility connects the RX/TX netmap buffers of an interface to the same buffers on a different interface by memory mapping these buffers to the same location and either copying or zero-copy-forwarding the packets between these buffers. These buffers are completely disconnected from the host stack and as such, no packets will be visible using tcpdump on DEVICE. Therefore I modified the bridge utility without affecting it's internal workings. This can (and has been) proved by building the original bridge utility and observing the same behaviour as described above.

**Environment**
OPNsense 21.1.a (amd64, OpenSSL).
AMD® EPYC 8-core
Network Intel® PRO/1000 PCIe

**Comment by swhite2** [comment]
It seems that (credits to) Vincenzo Maffione has discussed this issue in the FreeBSD-hackers mailing list. The promiscous patch is intended to remove a forced (non-deducable) promiscuous mode setting; meaning that in order to correctly use the bridge utility, promiscous mode should explicitly be set on both interfaces. Please see https://lists.freebsd.org/pipermail/freebsd-hackers/2020-November/056739.html

It is only logical, since ARP replies are by definition unicast to a set MAC address and will therefore be ignored on a bridged interface, my mistake!

Although it has been documented in the general netmap FAQ, the bridge man page will be updated by Vincenzo.

**Comment by fichtner** [comment]
Nice catch, thanks for sharing the details :)
